{
  "schema_version": 1,
  "record_type": "retarget-invitation",
  "code": {
    "schema_version": 1,
    "record_type": "enrollment-code",
    "code_id": "code-11111111111111111111111111111111",
    "request_id": "pair-workstation-1",
    "request_digest": "1111111111111111111111111111111111111111111111111111111111111111",
    "name": "workstation",
    "controller_url": "https://192.0.2.10:8443",
    "certificate_sha256": "2222222222222222222222222222222222222222222222222222222222222222",
    "created_at": 1790812800,
    "expires_at": 1790813100
  },
  "scope": {
    "schema_version": 1,
    "old_device_id": "old-target",
    "old_generation": "old-generation",
    "old_generation_sha256": "aaaaaaaaaaaaaaaaaaaaaaaaaaaaaaaaaaaaaaaaaaaaaaaaaaaaaaaaaaaaaaaa",
    "media_instance_id": "retained-media",
    "old_target_binding": {
      "schema_version": 1,
      "system_uuid": "aaaaaaaa-aaaa-aaaa-aaaa-aaaaaaaaaaaa"
    },
    "new_target_binding": {
      "schema_version": 1,
      "system_uuid": "bbbbbbbb-bbbb-bbbb-bbbb-bbbbbbbbbbbb"
    }
  },
  "boot_authorized": false,
  "one_shot_cleared": false,
  "old_evidence_drained": false
}
